{
  "schema": "night-shift/night@1",
  "night": "2026-09-28-a",
  "status": "complete",
  "started_at": "2026-09-28T01:42:05+03:00",
  "ended_at": "2026-09-28T02:24:25+03:00",
  "summary": "Each night now shows one state, coloured by whose turn it is (TASK-24): built, reviewed in 4 rounds, all passing, on branch night/2026-09-28 waiting for your look before it merges. The Git Bash hook failure (TASK-37) was a slow test in the testing repository, not Night Shift.",
  "session": {
    "harness": "claude-code",
    "id": "d05d2575-8528-4b86-9570-aeb70eeb87b4",
    "pid": 39132,
    "transcript": "C:\\Users\\jimzord12\\.claude-personal\\projects\\C--Users-jimzord12-Documents-GitHub-night-shift\\d05d2575-8528-4b86-9570-aeb70eeb87b4.jsonl"
  },
  "tasks": [
    {
      "id": "T1",
      "title": "Derive one owner state per night and colour it by whose turn it is",
      "source": "backlog TASK-24 (D24), named first in the session handoff",
      "done_when": [
        "A settled night that stopped early with tasks never started shows one green Done badge and a grey 'Stopped early: N tasks never started' line, never an orange dot beside a tick; one that stopped early at no cost shows no such line (screenshot)",
        "A night whose follow-up has open items shows Waiting for an agent in blue, and after two days says how long it has waited (test on real files, screenshot)",
        "Every state maps to exactly one colour and label, used alike on cards, the report and History (tests on the shared rule)",
        "npm run check passes, the code-reviewer and design-reviewer gates pass, pushed on the night branch"
      ],
      "outcome": "done",
      "checks": [
        {
          "done_when": "A settled night that stopped early with tasks never started shows one green Done badge and a grey 'Stopped early: N tasks never started' line, never an orange dot beside a tick; one that stopped early at no cost shows no such line (screenshot)",
          "met": true
        },
        {
          "done_when": "A night whose follow-up has open items shows Waiting for an agent in blue, and after two days says how long it has waited (test on real files, screenshot)",
          "met": true
        },
        {
          "done_when": "Every state maps to exactly one colour and label, used alike on cards, the report and History (tests on the shared rule)",
          "met": true
        },
        {
          "done_when": "npm run check passes, the code-reviewer and design-reviewer gates pass, pushed on the night branch",
          "met": true
        }
      ],
      "evidence": [
        {
          "type": "compare",
          "before": "evidence/history-before-v12.png",
          "after": "evidence/history-1440.png",
          "caption": "History on the same synthetic sample: v12 (an orange Stopped early beside Nothing left or Handed over) and now (one badge per night; a grey stopped-early line only where tasks never started)"
        },
        {
          "type": "image",
          "path": "evidence/report-billing-done-stopped-early.png",
          "caption": "A settled night that stopped early with 2 tasks never started: one green Done badge and the grey line"
        },
        {
          "type": "image",
          "path": "evidence/report-mobile-waiting-3-days.png",
          "caption": "A night whose follow-up has open items, saved 3 days ago: Waiting for an agent · 3 days, in blue"
        },
        {
          "type": "image",
          "path": "evidence/morning-1440.png",
          "caption": "Morning: every night not Done, one badge each; the heading counts only the nights that are your turn"
        },
        {
          "type": "image",
          "path": "evidence/history-390.png",
          "caption": "History at phone width: no sideways scroll, the grey line wraps inside its card"
        },
        {
          "type": "image",
          "path": "evidence/morning-all-waiting.png",
          "caption": "When nothing is your turn: In progress above one All caught up card"
        },
        {
          "type": "image",
          "path": "evidence/unreadable-night-opened.png",
          "caption": "A night file that cannot be read: red chip, not counted, and opening it says why instead of loading forever"
        },
        {
          "type": "command",
          "command": "npm run check",
          "exit_code": 0,
          "excerpt": "TypeScript: No errors found\nℹ tests 32\nℹ pass 32\nℹ fail 0\n✓ built"
        },
        {
          "type": "note",
          "text": "Review gate: 4 rounds, each with a fresh code, design and visual reviewer. Round 1 found a phone overflow (Blocking) and an unseen all-waiting screen (Material); round 3 found an error banner that followed you to the next night (Material, Blocking at phone width). All fixed; round 4 passed all three with notes only. Reports in docs/work/TASK-24/reviews. Screenshots use synthetic sample nights, not a real repository. Not verified: your own look on a real Adopter's nights. The discuss clause lands with TASK-29. The code is on branch night/2026-09-28, not merged into main yet."
        }
      ],
      "recorded_at": "2026-09-28T02:24:15+03:00"
    },
    {
      "id": "T2",
      "title": "Find out why an Adopter's pre-commit hook failed the history commit from Git Bash",
      "source": "backlog TASK-37 (triage spike), named in the session handoff",
      "done_when": [
        "The cause is reproduced with the hook's output captured, and either fixed in the tool or recorded as a limitation with a workaround on the task"
      ],
      "outcome": "done",
      "checks": [
        {
          "done_when": "The cause is reproduced with the hook's output captured, and either fixed in the tool or recorded as a limitation with a workaround on the task",
          "met": true
        }
      ],
      "evidence": [
        {
          "type": "command",
          "command": "node repro.ts <scratch clone> gitbash   (the tool's exact git commit --only call, from Git Bash, first run)",
          "exit_code": 1,
          "excerpt": "→ lint-staged could not find any staged files matching configured tasks.\n ❯ scripts/local-postgres/core.test.ts (14 tests | 1 failed) 7469ms\n     × uses a synthetic local user distinct from Playwright fixtures 7433ms\nError: Test timed out in 5000ms.\n ❯ src/modules/auth/infrastructure/local-mailbox.test.ts (3 tests | 1 failed)\n      Tests  2 failed | 749 passed (751)\n   Duration  10.92s\nhusky - pre-commit script failed (code 1)"
        },
        {
          "type": "command",
          "command": "the same hook run three more times from Git Bash",
          "exit_code": 1,
          "excerpt": "run 2:  Tests 1 failed | 750 passed (751) | 0 timeouts | Duration 7.88s\nrun 3:  Tests 1 failed | 750 passed (751) | 0 timeouts | Duration 7.84s\nrun 4:  Tests 1 failed | 750 passed (751) | 0 timeouts | Duration 8.44s\n(the one failure is local-mailbox, which fails in both shells only because the scratch clone sits in the temp folder)"
        },
        {
          "type": "command",
          "command": "pnpm exec vitest run scripts/local-postgres/core.test.ts   (from Git Bash, twice)",
          "exit_code": 0,
          "excerpt": "bash run 1: Tests  14 passed (14)\nbash run 2: Tests  14 passed (14)"
        },
        {
          "type": "note",
          "text": "Cause: the testing repository's pre-commit hook runs its whole 751-test suite on every commit, including Night Shift's history commit, and one test with a 5 second timeout is load-sensitive; it timed out on a cold first run. The shell was a coincidence and Night Shift calls git the same way from either shell. Recorded on TASK-37 as a limitation with a workaround: commit the history later with git commit --only -- .night-shift/history (hooks still run), or let the Adopter's hook skip tests when only .night-shift/ is staged. Not verified: that the original failure in the real repository was this same timeout, since its output was not captured."
        }
      ],
      "recorded_at": "2026-09-28T01:56:31+03:00"
    }
  ],
  "skipped_follow_ups": [],
  "questions": [],
  "feedback": [
    {
      "id": "F1",
      "kind": "tool-bug",
      "title": "A failed history commit keeps only the hook's last line",
      "tags": [
        "cli",
        "git"
      ],
      "body": "When a repository's pre-commit hook fails the history commit, the tool reports only the last line of git's output (for example 'husky - pre-commit script failed (code 1)'). The reason (which test failed, a timeout) is lost, so finding the cause meant reproducing the commit by hand with the full output captured. Keeping the last lines of the hook's output, or saving it to a file in the night folder, would make the cause visible at once.",
      "sent": null
    }
  ],
  "metrics": {
    "source": "claude-code",
    "harness_version": "2.1.283",
    "session_id": "d05d2575-8528-4b86-9570-aeb70eeb87b4",
    "measured_at": "2026-09-28T09:29:59+03:00",
    "duration_min": {
      "total": 76.99,
      "model": null,
      "tools": null
    },
    "models": {
      "claude-opus-5-5": {
        "tokens": {
          "input": 958,
          "output": 144015,
          "reasoning": 28153,
          "cache_read": 49214662,
          "cache_write": 1132293
        },
        "cost_usd": 19.31
      }
    },
    "cost_usd": 19.31,
    "sub_agents": [
      {
        "type": "code-reviewer",
        "model": "claude-opus-5-5",
        "purpose": "Code review TASK-24 round 2"
      },
      {
        "type": "design-reviewer",
        "model": "claude-opus-5-5",
        "purpose": "Design review TASK-24 round 1"
      },
      {
        "type": "visual-reviewer",
        "model": "claude-opus-5-5",
        "purpose": "Visual review TASK-24 round 1"
      },
      {
        "type": "visual-reviewer",
        "model": "claude-opus-5-5",
        "purpose": "Visual review TASK-24 round 4"
      },
      {